{
  "schema_version": "1.0.0",
  "access_id": "copernicus.cems.rapid-mapping.public-activations",
  "source_ids": [
    "copernicus.cems.on-demand-mapping"
  ],
  "provider": "Copernicus Emergency Management Service (CEMS) / European Commission",
  "interface_type": "rest",
  "status": "documented_only",
  "documentation_url": "https://mapping.emergency.copernicus.eu/about/how-to-harvest-cems-mapping-data/emergency-response-data/",
  "service_root": "https://rapidmapping.emergency.copernicus.eu",
  "api_version": null,
  "access_scope": [
    "metadata",
    "catalogue"
  ],
  "authentication": {
    "mode": "none",
    "credential_reference": null,
    "registration_url": null,
    "secret_in_repository": false
  },
  "request_contract": {
    "allowed_operations": [
      "list_public_activations",
      "get_public_activation"
    ],
    "path_templates": [
      "/backend/dashboard-api/public-activations-info/",
      "/backend/dashboard-api/public-activations/"
    ],
    "parameter_rules": "The documented public interface exposes activation-list and activation-detail operations, but this contract does not currently authorize execution. Any future implementation must be repository-constructed only: a catalogue check must fix a minimal limit and must not accept caller-supplied host, path, headers, offset, ordering, download URL or unrestricted query parameters. A future get_public_activation operation may accept exactly one validated public Rapid Mapping activation code and map it to the documented code query parameter; it must reject sensitive/restricted records and must not follow product download URLs under this contract. Any product ZIP, GeoPackage, GeoJSON, COG, vector-tile or other asset fetch requires a separately reviewed bounded sample/acquisition operation."
  },
  "response_contract": {
    "expected_media_types": [
      "application/json"
    ],
    "format": "Copernicus CEMS Rapid Mapping public dashboard JSON for activation catalogue or bounded activation metadata.",
    "scientific_semantics": "The documented Rapid Mapping interface exposes operational emergency-mapping activation, AOI, product, imagery, layer and summary-statistics metadata. Rapid Mapping products are provider-derived geospatial outputs produced from satellite imagery and other geospatial data for specific AOIs and acquisition times. Technical public accessibility does not make an activation immutable, establish API automation rights, prove product completeness or accuracy, clear sensitive/third-party content, or turn delineation, grading, exposure or consequence outputs into direct physical hazard observations, surveyed damage or universal ground truth."
  },
  "operational_constraints": {
    "timeout_seconds": 30,
    "max_probe_bytes": 1048576,
    "max_sample_bytes": 5242880,
    "retry_policy": "bounded_backoff",
    "rate_limit_notes": "No execution or repository-specific request-rate entitlement is authorized under the current contract. If service-use terms are independently cleared later, any connection check must remain a minimal bounded request; bulk harvesting, pagination and concurrent crawling remain outside this contract unless separately reviewed.",
    "mutability_notes": "The service is an operational rolling catalogue. Activation status, AOIs, products, imagery, statistics and product versions can change. Any future execution receipt must bind retrieval UTC, exact trusted execution-code identity, normalized request identity, response byte count and SHA-256; scientific use must separately freeze the exact activation/AOI/product type/version, imagery acquisition/sensor, feasibility/status and known limitations selected."
  },
  "rights_and_policy": {
    "dataset_rights_status": "verified",
    "api_terms_status": "unknown",
    "terms_url": null,
    "commercial_automation_status": "unknown",
    "redistribution_status": "allowed",
    "notes": "The reviewed CEMS On-Demand Mapping terms permit reproduction, distribution, public communication, adaptation, modification and combination of covered public CEMS data subject to source citation, with restricted data and third-party information requiring separate treatment. The provider's Rapid Mapping API documentation establishes anonymous technical access, but no authoritative service/API automation term has been identified that proves those dataset reuse terms are also the service-use terms. Dataset reuse rights therefore remain verified while API/service-use and commercial automation remain fail-closed and unknown."
  },
  "probe_contract": {
    "mode": "none",
    "operation": null,
    "requires_credentials": false,
    "expected_evidence": []
  },
  "implementation_decision": "document_only",
  "reviewed_at": "2026-08-12",
  "evidence_urls": [
    "https://mapping.emergency.copernicus.eu/about/how-to-harvest-cems-mapping-data/",
    "https://mapping.emergency.copernicus.eu/about/how-to-harvest-cems-mapping-data/emergency-response-data/",
    "https://mapping.emergency.copernicus.eu/about/rapid-mapping-manual/product-overview/what-is-a-product/",
    "https://mapping.emergency.copernicus.eu/about/rapid-mapping-portfolio/",
    "https://mapping.emergency.copernicus.eu/terms-and-conditions/"
  ],
  "notes": "Static documentation contract only. The official documentation identifies public activation-list and activation-detail JSON routes and richer product metadata/download links, but no provider request is authorized here while service/API-use terms remain unresolved. A later execution proposal must independently clear service-use terms before enabling any probe, then preserve product-specific semantics and keep product acquisition as a separately reviewed operation. No external provider bytes were acquired or persisted by this remediation."
}
