{
  "schema_version": "1.0.0",
  "access_id": "ioc.vliz.slsmf.registered-api.documented",
  "source_ids": [
    "ioc.vliz.slsmf"
  ],
  "provider": "Intergovernmental Oceanographic Commission of UNESCO / Flanders Marine Institute (VLIZ)",
  "interface_type": "rest",
  "status": "restricted_by_terms",
  "documentation_url": "https://api.ioc-sealevelmonitoring.org/v2/doc",
  "service_root": "https://api.ioc-sealevelmonitoring.org",
  "api_version": "v2",
  "access_scope": [
    "metadata",
    "catalogue",
    "realtime"
  ],
  "authentication": {
    "mode": "api_key",
    "credential_reference": "IOC_SLSMF_API_KEY",
    "registration_url": "https://ioc-sealevelmonitoring.org/api.php",
    "secret_in_repository": false
  },
  "request_contract": {
    "allowed_operations": [
      "inspect_v2_api_documentation"
    ],
    "path_templates": [
      "/v2/doc"
    ],
    "parameter_rules": "Documentation-only contract. The provider states that API v2 requires an API key: users register for an SLSMF account and request membership in the 'Access gauges API (gauges_API)' group. IOC_SLSMF_API_KEY is only a symbolic future secret reference; no key is stored or requested by this repository. No automated station/data request is authorized here, and callers may not supply arbitrary hosts, paths, headers or query parameters."
  },
  "response_contract": {
    "expected_media_types": [
      "application/json",
      "text/html"
    ],
    "format": "IOC/VLIZ SLSMF API v2 documentation (OAS 3.0) and, only after a later rights review, explicitly bounded v2 station/sensor responses.",
    "scientific_semantics": "The live station API exposes heterogeneous real-time sea-level feeds; the v2 research endpoint is separately quality-controlled and has distinct semantics. Station operator, sensor, datum, sampling, gaps, quality-control flags and feed lineage must be preserved; overlapping DART/SLSMF feeds must not automatically be counted as independent evidence."
  },
  "operational_constraints": {
    "timeout_seconds": 30,
    "max_probe_bytes": 524288,
    "max_sample_bytes": 1048576,
    "retry_policy": "none",
    "rate_limit_notes": "No automated provider API probing is authorized by this documentation-only restricted contract. Exact v2 provider limits and credential handling must be reviewed before any future probe.",
    "mutability_notes": "API v2 is the provider's latest documented version and has recorded breaking changes. Station availability, sensors, sampling and feeds can change; any future accepted response requires retrieval time, endpoint version and source/feed lineage."
  },
  "rights_and_policy": {
    "dataset_rights_status": "restricted",
    "api_terms_status": "separate_unreviewed",
    "terms_url": "https://www.ioc-sealevelmonitoring.org/disclaimer.php",
    "commercial_automation_status": "prohibited",
    "redistribution_status": "unknown",
    "notes": "The SLSMF web-service Data Policy states that data/products available through the website may not be used commercially and directs commercial users to the relevant data originators. The v2 OpenAPI page identifies its API description as CC-BY 4.0, but that documentation metadata is not treated as a commercial-use licence for the underlying station data or as clearance of API-specific terms."
  },
  "probe_contract": {
    "mode": "none",
    "operation": null,
    "requires_credentials": true,
    "expected_evidence": []
  },
  "implementation_decision": "do_not_automate",
  "reviewed_at": "2026-08-11",
  "evidence_urls": [
    "https://api.ioc-sealevelmonitoring.org/",
    "https://api.ioc-sealevelmonitoring.org/v2/doc",
    "https://ioc-sealevelmonitoring.org/api.php",
    "https://www.ioc-sealevelmonitoring.org/disclaimer.php"
  ],
  "notes": "Current provider evidence binds this documentation-only record to API v2 and its API-key/account/group flow while preserving the stricter legal boundary. No API key is committed or used, and the contract remains restricted_by_terms / do_not_automate until commercial/API-specific terms are explicitly cleared for the intended insurance context."
}
